Descript,predCategory
HABITUAL TRUANT,OTHER OFFENSES
GRAND THEFT COIN OPERATED MACHINE,LARCENY/THEFT
ACCIDENTAL BURNS,NON-CRIMINAL
"TELEPHONE OR TELEGRAPH MESSAGE, SENDING FALSE",OTHER OFFENSES
"BURGLARY OF WAREHOUSE, ATTEMPTED FORCIBLE ENTRY",BURGLARY
OTHER OFFENSES AGAINST PUBLIC JUSTICE,OTHER OFFENSES
"FORGERY, NOTES",FORGERY/COUNTERFEITING
VANDALISM OR GRAFFITI ON OR WITHIN 100 FT OF HIGHWAY,VANDALISM
POSSESSION OF OPIUM FOR SALES,DRUG/NARCOTIC
THREATENING PHONE CALL(S),ASSAULT
WARRANT ARREST,WARRANTS
"VEHICLE, RECOVERED, CAMPER-HOUSE CAR-MOTOR HOME",VEHICLE THEFT
"SHOPLIFTING, FORCE AGAINST AGENT",ROBBERY
ATTEMPTED ROBBERY CHAIN STORE WITH A KNIFE,ROBBERY
"HAZARDOUS MATERIALS, TRANSPORT WITHOUT PERMIT",OTHER OFFENSES
"ANIMAL, FIGHTING",OTHER OFFENSES
"EVADING A POLICE OFFICER, INJURY OR DEATH",OTHER OFFENSES
POSSESSION OF BASE/ROCK COCAINE FOR SALE,DRUG/NARCOTIC
GRAND THEFT PURSESNATCH,LARCENY/THEFT
PETTY THEFT FROM UNLOCKED AUTO,LARCENY/THEFT
"CHECKS, NON-SUFFICIENT FUNDS (FELONY)",BAD CHECKS
"BURGLARY,STORE UNDER CONSTRUCTION, FORCIBLE ENTRY",BURGLARY
SUSPICIOUS ACT TOWARDS CHILD,SUSPICIOUS OCC
POSSESSION OF METH-AMPHETAMINE FOR SALE,DRUG/NARCOTIC
"HAZARDOUS MATERIALS, DUMPING IN UNAUTHORIZED LOCATN",OTHER OFFENSES
CHILD ABUSE (PHYSICAL),ASSAULT
ENCOURAGE MINOR TO USE BARBITUATES,DRUG/NARCOTIC
ATTEMPTED THEFT COIN OPERATED MACHINE,LARCENY/THEFT
"DRIVING WHILE UNDER THE INFLUENCE OF DRUGS, W/INJURY",DRIVING UNDER THE INFLUENCE
LYNCHING BY RIOT,OTHER OFFENSES
"BURGLARY OF STORE, UNLAWFUL ENTRY",BURGLARY
POSSESSION OF AIR GUN,WEAPON LAWS
"BURGLARY OF FLAT, ATTEMPTED FORCIBLE ENTRY",BURGLARY
"BURGLARY OF HOTEL ROOM, FORCIBLE ENTRY",BURGLARY
FALSE EVIDENCE OF VEHICLE REGISTRATION,OTHER OFFENSES
MINOR PURCHASING OR RECEIVING TOBACCO PRODUCT,OTHER OFFENSES
"SEXUAL CONTACT WITH PATIENT, FORMER PATIENT","SEX OFFENSES, NON FORCIBLE"
AGGRAVATED ASSAULT WITH BODILY FORCE,ASSAULT
EMBEZZLED VEHICLE,NON-CRIMINAL
PETTY THEFT SHOPLIFTING,LARCENY/THEFT
"BURGLARY,BLDG. UNDER CONSTRUCTION, UNLAWFUL ENTRY",BURGLARY
UNDER THE INFLUENCE OF CONTROLLED SUBSTANCES,DRUG/NARCOTIC
ROBBERY OF A COMMERCIAL ESTABLISHMENT WITH A GUN,ROBBERY
VANDALISM WITH NOXIOUS CHEMICAL,VANDALISM
"VEHICLE ALARM CODE GRABBING DEVICE, POSSESS OR USE",OTHER OFFENSES
SOLICITS TO VISIT HOUSE OF PROSTITUTION,PROSTITUTION
"CREDIT CARD, THEFT OF",FRAUD
PUBLIC TRANSIT CRIMES - INFRACTIONS,OTHER OFFENSES
MAYHEM WITH A DEADLY WEAPON,ASSAULT
EVADING A POLICE VEHICLE OR BICYCLE,OTHER OFFENSES
POSSESSION OF OPIUM DERIVATIVE FOR SALES,DRUG/NARCOTIC
"ROBBERY, VEHICLE FOR HIRE, ATT., W/ FORCE",ROBBERY
POSS OF LOADED FIREARM,WEAPON LAWS
"BURGLARY, ATTEMPTED FORCIBLE ENTRY",BURGLARY
SAFE BURGLARY OF A WAREHOUSE,BURGLARY
"CABLE TV CONNECTION OR DECODING DEVICE, UNAUTHORIZED",FRAUD
SAFE BURGLARY OF A FLAT,BURGLARY
"BURGLARY,STORE UNDER CONSTRUCTION, UNLAWFUL ENTRY",BURGLARY
CONSUMING ALCOHOL IN PUBLIC VIEW,LIQUOR LAWS
MISSING JUVENILE,MISSING PERSON
MAYHEM WITH BODILY FORCE,ASSAULT
CARJACKING WITH BODILY FORCE,ROBBERY
"FORCIBLE RAPE, BODILY FORCE","SEX OFFENSES, FORCIBLE"
"MALICIOUS MISCHIEF, BREAKING WINDOWS WITH BB GUN",VANDALISM
SEARCH WARRANT SERVICE,NON-CRIMINAL
ATTEMPTED ROBBERY ON THE STREET WITH A KNIFE,ROBBERY
KIDNAPPING DURING ROBBERY,KIDNAPPING
"FIREWORKS, THROW AT PERSON OR DISCHARGE IN CROWD",OTHER OFFENSES
"ANIMAL, WITHOUT PROPER CARE OR ATTENTION",OTHER OFFENSES
OVERCHARGING TAXI FARE,OTHER OFFENSES
FRAUDULENT CREDIT APPLICATION,FRAUD
FAILURE TO REGISTER AS NARCOTICS ADDICT,OTHER OFFENSES
ATTEMPTED GRAND THEFT FROM PERSON,LARCENY/THEFT
"EMBEZZLEMENT, GRAND THEFT BY PROPERTY CARRIER",LARCENY/THEFT
ENCOURAGING MINOR TO USE COCAINE,DRUG/NARCOTIC
"TRICK AND DEVICE, GRAND THEFT",FRAUD
OBSCENE PHONE CALLS(S),OTHER OFFENSES
CHILD ABUSE SEXUAL,"SEX OFFENSES, FORCIBLE"
PANDERING,OTHER OFFENSES
"TRICK AND DEVICE, PETTY THEFT",FRAUD
SUSPICIOUS PACKAGE,SUSPICIOUS OCC
"BURGLARY,RESIDENCE UNDER CONSTRT, UNLAWFUL ENTRY",BURGLARY
"VIN, ALTER OR REMOVE",OTHER OFFENSES
"DRUG LAB APPARATUS, POSSESSION",VANDALISM
"MALICIOUS MISCHIEF, TIRE SLASHING",VANDALISM
"THEFT, BOAT",LARCENY/THEFT
TRESPASSING ON RAILROAD TRAINS,TRESPASS
SAFE BURGLARY OF A WAREHOUSE WITH EXPLOSIVES,BURGLARY
"LOST PROPERTY, GRAND THEFT",NON-CRIMINAL
"SUSPICIOUS OCCURRENCE, POSSIBLE SHOTS FIRED",SUSPICIOUS OCC
TRANSPORTATION OF HEROIN,DRUG/NARCOTIC
"SCHOOL, PUBLIC, TRESPASS",OTHER OFFENSES
FALSE IMPRISONMENT,OTHER OFFENSES
ROBBERY ON THE STREET WITH A DANGEROUS WEAPON,ROBBERY
ROBBERY OF A BANK WITH A DANGEROUS WEAPON,ROBBERY
ATTEMPTED GRAND THEFT PICKPOCKET,LARCENY/THEFT
"FORGERY, CREDIT CARD",FRAUD
"AIDED CASE, SICK PERSON",NON-CRIMINAL
"ROBBERY, BODILY FORCE",ROBBERY
ROBBERY OF A COMMERCIAL ESTABLISHMENT W/ A KNIFE,ROBBERY
FALSIFYING JUDICIAL & PUBLIC RECORDS & DOCUMENTS,FORGERY/COUNTERFEITING
UNUSUAL OCCURENCE,SUSPICIOUS OCC
ATTEMPTED SHOPLIFTING,LARCENY/THEFT
"KIDNAPPING, JUVENILE VICTIM",KIDNAPPING
FAILURE TO HEED RED LIGHT AND SIREN,OTHER OFFENSES
VIOLATION OF CIVIL GANG INJUNCTION,OTHER OFFENSES
"DISTURBING THE PEACE, FIGHTING",DISORDERLY CONDUCT
SUSPICIOUS ACT TOWARDS FEMALE,SUSPICIOUS OCC
MISCELLANEOUS STATE FELONY,OTHER OFFENSES
AUTO IMPOUNDED,NON-CRIMINAL
HEATING VIOLATION  APT/HOTEL,OTHER OFFENSES
PUTTING SLUGS IN PARKING METERS,FRAUD
"EMBEZZLEMENT, PETTY THEFT BY COLLECTOR",EMBEZZLEMENT
"BURGLARY, HOT PROWL, UNLAWFUL ENTRY",BURGLARY
UNDER INFLUENCE OF DRUGS IN A PUBLIC PLACE,DRUNKENNESS
ATTEMPTED ROBBERY COMM. ESTAB. WITH BODILY FORCE,ROBBERY
"CONCEAL CRIME OR WITHHOLD EVIDENCE, ACCEPTING PAYMENT TO",BRIBERY
"FORGERY, FALSE ENTRIES IN RECORDS OR RETURNS",FORGERY/COUNTERFEITING
"BURGLARY OF FLAT, FORCIBLE ENTRY",BURGLARY
THROWING INJURIOUS SUBSTANCE ON HIGHWAY,OTHER OFFENSES
"EMBEZZLEMENT, PETTY THEFT OF LEASED PROPERTY",LARCENY/THEFT
"MALICIOUS MISCHIEF, VANDALISM",VANDALISM
VIOLATION OF RESTRICTIONS ON A FIREARM TRANSFER,WEAPON LAWS
POISONING ANIMALS,OTHER OFFENSES
"AIDED CASE, DOG BITE",NON-CRIMINAL
CARRYING A CONCEALED WEAPON,WEAPON LAWS
"STAY AWAY OR COURT ORDER, NON-DV RELATED",NON-CRIMINAL
"FORCIBLE RAPE, ARMED WITH A SHARP INSTRUMENT","SEX OFFENSES, FORCIBLE"
TRANSPORTATION OF COCAINE,DRUG/NARCOTIC
"BURGLARY, UNLAWFUL ENTRY",BURGLARY
ATTEMPTED ROBBERY CHAIN STORE WITH BODILY FORCE,ROBBERY
"THEFT, DRUNK ROLL, <$50",LARCENY/THEFT
ATTEMPTED SUICIDE BY JUMPING,SUICIDE
POSSESSION OF HALLUCINOGENIC,DRUG/NARCOTIC
ATTEMPTED THEFT FROM LOCKED VEHICLE,LARCENY/THEFT
TARASOFF REPORT,NON-CRIMINAL
CONSPIRACY,OTHER OFFENSES
POSSESSION OF HEROIN FOR SALES,DRUG/NARCOTIC
"BURGLARY,APT UNDER CONSTRUCTION, FORCIBLE ENTRY",BURGLARY
"BURGLARY OF STORE, FORCIBLE ENTRY",BURGLARY
AGGRAVATED ASSAULT ON POLICE OFFICER WITH A KNIFE,ASSAULT
ABORTION,OTHER OFFENSES
"BIGAMY, INCEST, AND THE CRIME AGAINST NATURE (GENERAL)",OTHER OFFENSES
POSSESSION OF HEROIN,DRUG/NARCOTIC
"VEHICLE, RECOVERED, MOBILE HOME-TRAILER",VEHICLE THEFT
SUICIDE BY STRANGULATION,SUICIDE
PETTY THEFT PHONE BOOTH,LARCENY/THEFT
ROBBERY OF A RESIDENCE WITH A DANGEROUS WEAPON,ROBBERY
BATTERY OF A POLICE OFFICER,ASSAULT
SALE OF ALCOHOL TO MINOR,DRUG/NARCOTIC
SOLICITS LEWD ACT,PROSTITUTION
PIMPING,PROSTITUTION
POST RELEASE COMMUNITY SUPERVISION,WARRANTS
"STOLEN CHECKS, POSSESSION",VEHICLE THEFT
ADVERTISING DISTRIBUTORS PERMIT VIOLATION,OTHER OFFENSES
"DISSUADING WITNESS, VICTIM",ASSAULT
"EMBEZZLEMENT, GRAND THEFT PRIVATE PROPERTY",LARCENY/THEFT
INDECENT EXPOSURE - PROSTITUTION RELATED,OTHER OFFENSES
"FLAMMABLE OR EXPLOSIVE DEVICE, POSSESSION",WEAPON LAWS
DISTURBING THE PEACE,DISORDERLY CONDUCT
"EMBEZZLEMENT, PETTY THEFT BY EMPLOYEE",EMBEZZLEMENT
EVADING A POLICE OFFICER RECKLESSLY,OTHER OFFENSES
MAINTAINING PREMISE WHERE NARCOTICS ARE SOLD/USED,DRUG/NARCOTIC
TRESPASSING,TRESPASS
POSS OF FIREARM BY CONVICTED FELON/ADDICT/ALIEN,WEAPON LAWS
GRAND THEFT AUTO STRIP,LARCENY/THEFT
PETTY THEFT COIN OPERATED MACHINE,LARCENY/THEFT
"DRIVING, RECKLESS, WITH INJURY",OTHER OFFENSES
ATTEMPTED SIMPLE ASSAULT,ASSAULT
BEYOND PARENTAL CONTROL,OTHER OFFENSES
TRAFFIC VIOLATION,OTHER OFFENSES
ROBBERY ON THE STREET WITH A GUN,ROBBERY
"ATTEMPTED RAPE, BODILY FORCE","SEX OFFENSES, FORCIBLE"
ABANDONMENT OF CHILD,LARCENY/THEFT
"ALCOHOLIC BEVERAGE, PROCURING SALE OF",DRUG/NARCOTIC
"BATTERY, FORMER SPOUSE OR DATING RELATIONSHIP",ASSAULT
"TRAFFIC COLLISION, HIT & RUN, INJURY",OTHER OFFENSES
"ROBBERY, ARMED WITH A DANGEROUS WEAPON",ROBBERY
STOLEN AUTOMOBILE,VEHICLE THEFT
BRIBERY OF WITNESSES,BRIBERY
THEFT OF UTILITY SERVICES,LARCENY/THEFT
"BURGLARY, HOT PROWL, FORCIBLE ENTRY",BURGLARY
FOUND PROPERTY,NON-CRIMINAL
ATTEMPTED THEFT FROM A BUILDING,LARCENY/THEFT
SODOMY,NON-CRIMINAL
FORTUNE TELLING,OTHER OFFENSES
"THEFT, DRUNK ROLL, $200-$400",LARCENY/THEFT
"HAZARDOUS MATERIALS, STORE WITHOUT PERMIT",OTHER OFFENSES
ROBBERY OF A COMMERCIAL ESTABLISHMENT W/ WEAPON,ROBBERY
MINOR ON ON-SALE LICENSED PREMISE,LIQUOR LAWS
TRANSPORTATION OF OPIATES,DRUG/NARCOTIC
PROBATION VIOLATION,OTHER OFFENSES
ENROUTE TO OUTSIDE JURISDICTION,WARRANTS
ATTEMPTED HOMICIDE WITH A GUN,ASSAULT
"ATTEMPTED KIDNAPPING, JUVENILE VICTIM",KIDNAPPING
SALE OF HALLUCINOGENIC,DRUG/NARCOTIC
"ASSAULT, AGGRAVATED, W/ SEMI AUTO",ASSAULT
MISCELLANEOUS INVESTIGATION,OTHER OFFENSES
"SCHOOL PROPERTY, DISTURBANCE ON",OTHER OFFENSES
SUICIDE BY FIREARMS,SUICIDE
HUMAN TRAFFICKING,PROSTITUTION
COMMITTING PUBLIC NUISANCE,DISORDERLY CONDUCT
ATTEMPTED SUICIDE BY FIREARMS,SUICIDE
SOLICITING COMMISSION OF A CRIME,OTHER OFFENSES
ESCAPE OF PRISONER WHILE HOSPITALIZED,OTHER OFFENSES
OPEN CONTAINER OF ALCOHOL IN VEHICLE,OTHER OFFENSES
SALE OF METH-AMPHETAMINE,DRUG/NARCOTIC
"WEAPON, DEADLY, EXHIBITING TO RESIST ARREST",ASSAULT
PETTY THEFT FROM LOCKED AUTO,LARCENY/THEFT
STOLEN MISCELLANEOUS VEHICLE,VEHICLE THEFT
ENGAGING IN LEWD ACT,OTHER OFFENSES
EVADING PAYMENT OF RAILROAD FARE,OTHER OFFENSES
"FALSE PRETENSES, GRAND THEFT",FRAUD
MISCELLANEOUS STATE MISDEMEANOR,OTHER OFFENSES
"CIVIL SIDEWALKS, WARNING",NON-CRIMINAL
LOST/STOLEN LICENSE PLATE,OTHER OFFENSES
"BURGLARY,RESIDENCE UNDER CONSTRT, FORCIBLE ENTRY",BURGLARY
"AGGRAVATED ASSAULT OF POLICE OFFICER,BODILY FORCE",ASSAULT
LICENSE REQUIRED TO SELL ALCOHOL,LIQUOR LAWS
TAMPERING WITH MAIL,OTHER OFFENSES
ATTEMPTED MOTORCYCLE STRIP,LARCENY/THEFT
TRAFFIC VIOLATION ARREST,OTHER OFFENSES
"WEAPON, DEADLY, CARRYING WITH INTENT TO COMMIT ASSAULT",WEAPON LAWS
"ATTEMPTED KIDNAPPING, ADULT VICTIM",KIDNAPPING
"THEFT, GRAND, BY FIDUCIARY, >$400 IN 12 MONTHS",LARCENY/THEFT
ENCOURAGING MINOR TO USE MARIJUANA,DRUG/NARCOTIC
POSS OF PROHIBITED WEAPON,WEAPON LAWS
"FIRE, UNLAWFULLY CAUSING",ASSAULT
ESCAPE FROM JAIL,OTHER OFFENSES
DISRUPTS SCHOOL ACTIVITIES,OTHER OFFENSES
ATTEMPTED THEFT PHONE BOOTH,LARCENY/THEFT
ATTEMPTED ROBBERY CHAIN STORE WITH A GUN,ROBBERY
SAFE BURGLARY OF A HOTEL,BURGLARY
DEFRAUDING OF VEHICLE REPAIRMAN,FRAUD
SALE OF METHADONE,DRUG/NARCOTIC
DUMPING OF OFFENSIVE MATTER,OTHER OFFENSES
"PERMIT VIOLATION, ENTERTAINMENT",OTHER OFFENSES
ATTEMPTED ROBBERY OF A BANK WITH A DEADLY WEAPON,ROBBERY
IMPOUNDED VEHICLE,NON-CRIMINAL
"STAY AWAY ORDER VIOLATION, DV RELATED",OTHER OFFENSES
"FALSE PRETENSES, PETTY THEFT",FRAUD
"FALSE CLAIMS, PRESENTING TO GOVERNMENT",FRAUD
ATTEMPTED ROBBERY COMM. ESTABLISHMENT WITH A GUN,ROBBERY
YOUTH COURT,NON-CRIMINAL
"AMMUNITION, POSS. BY PROHIBITED PERSON",WEAPON LAWS
BATTERY WITH SERIOUS INJURIES,ASSAULT
"MALICIOUS MISCHIEF, FICTITIOUS PHONE CALLS",OTHER OFFENSES
POSSESSION OF OPIUM DERIVATIVE,DRUG/NARCOTIC
MISSING ADULT,MISSING PERSON
ATTEMPTED ROBBERY SERVICE STATION WITH A GUN,ROBBERY
ATTEMPTED ROBBERY RESIDENCE WITH A KNIFE,ROBBERY
POSSESSION OF CONTROLLED SUBSTANCE FOR SALE,DRUG/NARCOTIC
UNLAWFUL DISSUADING/THREATENING OF A WITNESS,ASSAULT
WILLFUL CRUELTY TO CHILD,ASSAULT
PUSH-CART PEDDLER PERMIT VIOLATION,OTHER OFFENSES
ASSAULT TO RAPE WITH A DANGEROUS WEAPON,ASSAULT
STOLEN BUS,VEHICLE THEFT
"BURGLARY OF RESIDENCE, UNLAWFUL ENTRY",BURGLARY
POSSESSION OF OBSCENE MATTER FOR SALE,DRUG/NARCOTIC
ARSON OF AN INHABITED DWELLING,ARSON
PETTY THEFT MOTORCYCLE STRIP,LARCENY/THEFT
ATTEMPTED ROBBERY OF A BANK WITH A GUN,ROBBERY
SALE OF OPIUM DERIVATIVE,DRUG/NARCOTIC
"DEATH, NON-MANSLAUGHTER AUTO ACCIDENT",NON-CRIMINAL
DRIVES VEHICLE ALONG TRACK OF RAILROAD,OTHER OFFENSES
UNAUTHORIZED USE OF LOUD SPEAKERS,OTHER OFFENSES
INVESTIGATIVE DETENTION,SUSPICIOUS OCC
"DRIVING WHILE UNDER THE INFLUENCE OF ALCOHOL, W/INJURY",DRIVING UNDER THE INFLUENCE
"ROBBERY, ARMED WITH A KNIFE",ROBBERY
ATTEMPTED ROBBERY WITH A GUN,ROBBERY
SALE OF SATELLITE TELEPHONE NUMBER,OTHER OFFENSES
"MONEY, CHANGING FACE AMOUNT",FORGERY/COUNTERFEITING
SUICIDE,NON-CRIMINAL
"MALICIOUS MISCHIEF, JUVENILE SUSPECT",VANDALISM
ROBBERY OF A BANK WITH A KNIFE,ROBBERY
POSSESSION OF BASE/ROCK COCAINE,DRUG/NARCOTIC
PEDDLING WITHOUT A LICENSE,OTHER OFFENSES
FALSE REPORT OF EMERGENCY,FRAUD
FURNISHING MARIJUANA,DRUG/NARCOTIC
VIOLATION OF FEDERAL STATUTE,OTHER OFFENSES
THREATENING SCHOOL OR PUBLIC EMPLOYEE,ASSAULT
INMATE/KEEPER OF HOUSE OF PROSTITUTION,PROSTITUTION
"RAPE, SPOUSAL","SEX OFFENSES, FORCIBLE"
"BATHROOM HOLE, LOOKING THROUGH",OTHER OFFENSES
STOLEN AND RECOVERED VEHICLE,VEHICLE THEFT
ENROUTE TO DEPARTMENT OF CORRECTIONS,WARRANTS
"EMBEZZLEMENT, PETTY THEFT",LARCENY/THEFT
EMBEZZLEMENT (GENERAL),OTHER OFFENSES
BRIBERY OF EXECUTIVE OFFICER,ASSAULT
"ACCESS CARD INFORMATION, THEFT OF",FRAUD
VIOLATION OF EMERGENCY PROTECTIVE ORDER,OTHER OFFENSES
ATTEMPTED ROBBERY WITH BODILY FORCE,ROBBERY
INJURY TO TELEGRAPH/TELEPHONE LINES,OTHER OFFENSES
"SEXUAL ASSAULT, AGGRAVATED, OF CHILD",ASSAULT
CARJACKING WITH A KNIFE,ROBBERY
UNDER INFLUENCE OF ALCOHOL IN A PUBLIC PLACE,DRUNKENNESS
STOLEN MOTORCYCLE,VEHICLE THEFT
MAINTAINING A PUBLIC NUISANCE,DISORDERLY CONDUCT
ATTEMPTED GRAND THEFT PURSESNATCH,LARCENY/THEFT
REFUSAL TO IDENTIFY,NON-CRIMINAL
VIOLATION OF MUNICIPAL CODE,OTHER OFFENSES
THROWING SUBSTANCE AT VEHICLE,OTHER OFFENSES
SAFE BURGLARY OF A STORE,BURGLARY
"ELECTRICAL  OR GAS LINES, INTERFERING WITH",VANDALISM
"HAZARDOUS MATERIALS, DUMPING IN UNAUTHORIZED LOCATION",OTHER OFFENSES
ASSAULT TO RAPE WITH A SHARP INSTRUMENT,"SEX OFFENSES, FORCIBLE"
DAMAGE/DESTRUCTION OF MAIL,VANDALISM
"FIREARM, NEGLIGENT DISCHARGE",VEHICLE THEFT
CRIMES AGAINST REVENUE & PROPERTY OF STATE,OTHER OFFENSES
"CITIZENSHIP OR ALIEN REGISTRATION, MAKING FALSE DOCUMENT",FORGERY/COUNTERFEITING
"PERMIT VIOLATION, POLICE (GENERAL)",OTHER OFFENSES
"MONEY, PROPERTY OR LABOR, FRAUDULENTLY OBTAINING",OTHER OFFENSES
"SHORT CHANGE, PETTY THEFT",FRAUD
POSSESSION OF METHADONE FOR SALES,DRUG/NARCOTIC
SUICIDE BY LACERATION,SUICIDE
"PROBATION VIOLATION, DV RELATED",OTHER OFFENSES
"FORGERY, POSSESSION DRIVERS LICENSE OR ID-CARD",FORGERY/COUNTERFEITING
OPERATING TAXI WITHOUT A PERMIT,OTHER OFFENSES
ATTEMPTED EXTORTION,LARCENY/THEFT
SAFE BURGLARY,BURGLARY
"VANDALISM OR GRAFFITI TOOLS, POSSESSION",OTHER OFFENSES
"CHECKS, NON-SUFFICIENT FUNDS (MISDEMEANOR)",BAD CHECKS
ATTEMPTED MAYHEM WITH A KNIFE,ASSAULT
AIDED CASE,NON-CRIMINAL
INDECENT EXPOSURE (JUVENILE VICTIM),OTHER OFFENSES
FALSE PERSONATION TO RECEIVE MONEY OR PROPERTY,OTHER OFFENSES
ACTS AGAINST PUBLIC TRANSIT,OTHER OFFENSES
ASSAULT TO COMMIT MAYHEM OR SPECIFIC SEX OFFENSES,"SEX OFFENSES, FORCIBLE"
FIREARM WITH ALTERED IDENTIFICATION,NON-CRIMINAL
VIN SWITCH,OTHER OFFENSES
ATTEMPTED RAPE WITH A GUN,LARCENY/THEFT
DEFRAUDING AN INNKEEPER,FRAUD
"FRAUDULENT GAME OR TRICK, OBTAINING MONEY OR PROPERTY",OTHER OFFENSES
THEFT OF COMPUTERS OR CELL PHONES,LARCENY/THEFT
"VEHICLE, RENTAL, FAILURE TO RETURN",VEHICLE THEFT
VISITING WHERE DRUGS ARE USED OR SMOKED,DRUG/NARCOTIC
DESTROYING JAIL PROPERTY-$200 OR UNDER,VANDALISM
SUICIDE BY ASPHYXIATION,SUICIDE
"THEFT, GRAND, AGRICULTURAL",LARCENY/THEFT
SALE OF MARIJUANA,DRUG/NARCOTIC
FALSE ID TO PEACE OFFICER,FRAUD
THEFT OF CHECKS OR CREDIT CARDS,LARCENY/THEFT
"ORAL COPULATION, UNLAWFUL (ADULT VICTIM)","SEX OFFENSES, FORCIBLE"
DEFRAUDING TAXI DRIVER,OTHER OFFENSES
"TOBACCO PRODUCTS, SELLING OR FURNISHING TO MINOR",OTHER OFFENSES
"DEMONSTRATION, VIDEO EVIDENCE, MISC. INVESTIGATION",NON-CRIMINAL
LOOTING DURING STATE OF EMERGENCY,OTHER OFFENSES
FALSE PERSONATION AND CHEAT CRIMES (GENERAL),OTHER OFFENSES
ROBBERY OF A CHAIN STORE WITH A KNIFE,ROBBERY
"AEROSOL CONTAINER; SALE, PURCHASE OR POSSESSION OF",VANDALISM
FALSE PERSONATION,OTHER OFFENSES
FALSE REPORT OF CRIME,OTHER OFFENSES
"ASSAULT, AGGRAVATED, ON POLICE OFFICER, W/ GUN",ASSAULT
AGGRAVATED ASSAULT ON POLICE OFFICER WITH A GUN,ASSAULT
"BURGLARY OF APARTMENT HOUSE, UNLAWFUL ENTRY",BURGLARY
SALE OF ALCOHOL BY MINOR,DRUG/NARCOTIC
POSSESSION OF BURGLARY TOOLS,OTHER OFFENSES
"BURGLARY,FLAT UNDER CONSTRUCTION, FORCIBLE ENTRY",BURGLARY
"ROBBERY,  ATM, KNIFE, ATT.",ROBBERY
ASSAULT,ASSAULT
ATTEMPTED ARSON,LARCENY/THEFT
DISCHARGING IN GROSSLY NEGLIGENT MANNER,ASSAULT
ENROUTE TO U.S. MARSHALL,WARRANTS
INDECENT EXPOSURE,OTHER OFFENSES
POSSESSION OF COCAINE FOR SALES,DRUG/NARCOTIC
"TRAFFIC COLLISION, HIT & RUN, PROPERTY DAMAGE",OTHER OFFENSES
"CHILD, INFLICTING INJURY RESULTING IN TRAUMATIC CONDITION",ASSAULT
SOLICITING MINOR TO COMMIT FELONY,OTHER OFFENSES
"DEATH REPORT, CAUSE UNKNOWN",NON-CRIMINAL
CONTRIBUTING TO THE DELINQUENCY OF MINOR,OTHER OFFENSES
"FIREARM, DISCHARGING IN GROSSLY NEGLIGENT MANNER",ASSAULT
SUICIDE BY DROWNING,SUICIDE
GRAFFITI ON GOVERNMENT VEHICLES OR PUBLIC TRANSPORTATION,VANDALISM
"CHECKS, FORGERY (FELONY)",FORGERY/COUNTERFEITING
"ROBBERY ON THE STREET, STRONGARM",ROBBERY
"EMBEZZLEMENT, GRAND THEFT",LARCENY/THEFT
"BURGLARY,RESIDENCE UNDER CONSTRT, ATT. FORCIBLE",BURGLARY
SELLING RESTRICTED GLUE TO JUVENILES,OTHER OFFENSES
ASSAULT TO RAPE WITH A GUN,ASSAULT
ROBBERY OF A CHAIN STORE WITH A DANGEROUS WEAPON,ROBBERY
"STOLEN PROPERTY, POSSESSION WITH KNOWLEDGE, RECEIVING",STOLEN PROPERTY
CARJACKING WITH A DANGEROUS WEAPON,ROBBERY
"PHONE CALLS, OBSCENE",OTHER OFFENSES
"TRADE SECRETS, THEFT OR UNAUTHORIZED COPYING",LARCENY/THEFT
"CIVIL RIGHTS, INCL. INJURY, THREAT, OR DAMAGE (HATE CRIMES)",ASSAULT
DAMAGE TO FIRE ALARM APPARATUS,VANDALISM
"BURGLARY,WAREHOUSE UNDER CONSTRT, FORCIBLE ENTRY",BURGLARY
"VEHICLE, RECOVERED, AUTO",VEHICLE THEFT
"BURGLARY,HOTEL UNDER CONSTRUCTION, UNLAWFUL ENTRY",BURGLARY
"LASERS, DISCHARGING OR LIGHTS AT AIRCRAFT",ASSAULT
STALKING,ASSAULT
SALES COCAINE BASE/SCHOOLYARD TRAFFICKING ACT VIO,DRUG/NARCOTIC
POSSESSION OF BARBITUATES,DRUG/NARCOTIC
"PERMIT VIOLATION, SIDEWALK SALES",OTHER OFFENSES
OPERATING WITHOUT DANCEHALL PERMIT,OTHER OFFENSES
UNLAWFUL SEXUAL INTERCOURSE,NON-CRIMINAL
MALICIOUS MISCHIEF,VANDALISM
UNLAWFUL TRANSPORTATION OF ALCOHOL,DRUG/NARCOTIC
"PERMIT VIOLATION, SECOND-HAND DEALER",OTHER OFFENSES
"STOLEN COMPUTER, POSSESSION",VEHICLE THEFT
LOITERING FOR PURPOSE OF PROSTITUTION,PROSTITUTION
ROBBERY OF A SERVICE STATION WITH A KNIFE,ROBBERY
"ROBBERY,  ATM, OTHER WEAPON",ROBBERY
"BURGLARY OF APARTMENT HOUSE, FORCIBLE ENTRY",BURGLARY
"VEHICLE, RECOVERED, MOTORCYCLE",VEHICLE THEFT
"CREDIT CARD, INCOMPLETE OR COUNTERFEIT",FRAUD
"HYPODERMIC NEEDLE OR SYRINGE, POSSESSION",DRUG/NARCOTIC
TURNED IN GUN,NON-CRIMINAL
VIOLATION OF STAY AWAY ORDER,OTHER OFFENSES
"THEFT, BICYCLE, <$50, NO SERIAL NUMBER",LARCENY/THEFT
"BURGLARY OF STORE, ATTEMPTED FORCIBLE ENTRY",BURGLARY
POSS OF FIRE BOMB,OTHER OFFENSES
LOITERING WITHOUT LAWFUL BUSINESS WITH OWNER OR OCCUPANT,TRESPASS
POSSESSION OF MACHINE GUN,LARCENY/THEFT
"EMBEZZLEMENT, PETTY THEFT PRIVATE PROPERTY",LARCENY/THEFT
POSSESSION OF CONTROLLED SUBSTANCE,DRUG/NARCOTIC
"RESISTING PEACE OFFICER, CAUSING THEIR SERIOUS INJURY OR DEATH",ASSAULT
"WEAPON, POSSESS OR BRING OTHER ON SCHOOL GROUNDS",WEAPON LAWS
"TRUANT, HABITUAL",OTHER OFFENSES
SAFE BURGLARY OF AN APARTMENT,BURGLARY
FRAUDULENT AUCTION,FRAUD
ROBBERY OF A SERVICE STATION WITH A GUN,ROBBERY
CARRYING OF CONCEALED WEAPON BY CONVICTED FELON,WEAPON LAWS
ATTEMPTED SUICIDE BY STRANGULATION,SUICIDE
"STOLEN ACCESS CARD, POSSESSION",FRAUD
"OBSCENE MATTER, DISTRIBUTION TO MINORS",OTHER OFFENSES
JUVENILE PAROLE VIOLATOR,OTHER OFFENSES
"BURGLARY OF WAREHOUSE, UNLAWFUL ENTRY",BURGLARY
INCIDENT ON SCHOOL GROUNDS,OTHER OFFENSES
DESTITUTE MINOR,OTHER OFFENSES
LOITERING WHERE NARCOTICS ARE SOLD/USED,DRUG/NARCOTIC
SHELTER,NON-CRIMINAL
ATTEMPTED ROBBERY ON THE STREET WITH A GUN,ROBBERY
"BURGLARY,APT UNDER CONSTRUCTION, UNLAWFUL ENTRY",BURGLARY
POSSESSION OF AMPHETAMINE,DRUG/NARCOTIC
OPERATING WITHOUT CABARET PERMIT,OTHER OFFENSES
"FORGERY, DRIVERS LICENSE OR ID-CARD",FORGERY/COUNTERFEITING
UNKNOWN COMPLAINT,OTHER OFFENSES
POSSESSION OF NARCOTICS PARAPHERNALIA,DRUG/NARCOTIC
CRUELTY TO ANIMALS,OTHER OFFENSES
DANGER OF LEADING IMMORAL LIFE,OTHER OFFENSES
REAL ESTATE FRAUD,FRAUD
"MALICIOUS MISCHIEF, ADULT SUSPECT",VANDALISM
SUICIDE BY JUMPING,SUICIDE
SEXUAL BATTERY,ASSAULT
PROBATION SEARCH,NON-CRIMINAL
"IDENTIFICATION, GOVERNMENT, POSSESS, MAKE OR SELL FALSE",FORGERY/COUNTERFEITING
LODGING WITHOUT PERMISSION,TRESPASS
MONEY OFFENSE RELATED TO NARCOTICS TRAFFICKING,DRUG/NARCOTIC
"DISTURBING THE PEACE, SWEARING",DISORDERLY CONDUCT
AGGRAVATED ASSAULT WITH A GUN,ASSAULT
COMMISSION OF FELONY WHILE ARMED,OTHER OFFENSES
"EMBEZZLEMENT, GRAND THEFT LEASED PROPERTY",LARCENY/THEFT
TRANSPORTATION OF AMPHETAMINE,DRUG/NARCOTIC
FRAUDULENT USE OF AUTOMATED TELLER CARD,FRAUD
"COMPUTER SYSTEM, ACCESSING, COPYING, OR DAMAGING",OTHER OFFENSES
"AUTO, GRAND THEFT OF",LARCENY/THEFT
"FIREARMS, SEIZING AT SCENE OF DV",OTHER OFFENSES
"WEAPON, POSSESSING IN PUBLIC BUILDING OR OPEN MEETING",WEAPON LAWS
SALE OF COCAINE,DRUG/NARCOTIC
SALE OF ALCOHOL AFTER HOURS,LIQUOR LAWS
"BURGLARY, FORCIBLE ENTRY",BURGLARY
"BURGLARY,BLDG. UNDER CONSTRUCTION, FORCIBLE ENTRY",BURGLARY
ENROUTE TO PAROLE OFFICER,WARRANTS
PETTY THEFT AUTO STRIP,LARCENY/THEFT
"EMBEZZLEMENT, PETTY THEFT BY BROOKERS/AGENTS",EMBEZZLEMENT
"AIDED CASE, MENTAL DISTURBED",NON-CRIMINAL
"SEXUAL ASSAULT, ADMINISTERING DRUG TO COMMIT","SEX OFFENSES, FORCIBLE"
ARSON,NON-CRIMINAL
ROBBERY OF A BANK WITH BODILY FORCE,ROBBERY
ATTEMPTED ROBBERY ON THE STREET WITH BODILY FORCE,ROBBERY
POSSESSION OF OPIATES FOR SALES,DRUG/NARCOTIC
ROBBERY OF A SERVICE STATION W/DANGEROUS WEAPON,ROBBERY
"EMBEZZLEMENT, GRAND THEFT BY EMPLOYEE",EMBEZZLEMENT
SAFE BURGLARY OF A RESIDENCE,BURGLARY
DESTRUCTION OF PROPERTY WITH EXPLOSIVES,NON-CRIMINAL
"BURGLARY OF HOTEL ROOM, ATTEMPTED FORCIBLE ENTRY",BURGLARY
"CREDIT CARD, THEFT BY USE OF",FRAUD
PETTY THEFT FROM A BUILDING,LARCENY/THEFT
"BURGLARY OF RESIDENCE, ATTEMPTED FORCIBLE ENTRY",BURGLARY
INTOXICATED JUVENILE,OTHER OFFENSES
"AUDIOVISUAL (VIDEO OR SOUND) RECORDINGS, UNAUTHORIZED",FRAUD
ARSON OF A VACANT BUILDING,ARSON
DRIVING WHILE UNDER THE INFLUENCE OF ALCOHOL,DRIVING UNDER THE INFLUENCE
POSSESSION OF ALCOHOL BY MINOR,DRUG/NARCOTIC
VIOLATION OF PARK CODE,OTHER OFFENSES
"FORCIBLE RAPE, ARMED WITH A DANGEROUS WEAPON",ROBBERY
GRAND THEFT FROM A BUILDING,LARCENY/THEFT
SALE OF AMPHETAMINE,DRUG/NARCOTIC
POSSESSION OF BURGLARY TOOLS W/PRIORS,OTHER OFFENSES
"STOLEN ELECTRONICS, POSSESSION",VEHICLE THEFT
SCALPING TICKETS,OTHER OFFENSES
THEFT FROM MERCHANT OR LIBRARY,LARCENY/THEFT
"DEATH, ACCIDENTAL",NON-CRIMINAL
MISPLACED VEHICLE,NON-CRIMINAL
DISTURBING RELIGIOUS MEETINGS,DISORDERLY CONDUCT
AGGRAVATED ASSAULT WITH A DEADLY WEAPON,ASSAULT
CASE CLOSURE,NON-CRIMINAL
ROBBERY OF A CHAIN STORE WITH BODILY FORCE,ROBBERY
"MALICIOUS MISCHIEF, BREAKING WINDOWS",VANDALISM
"STOLEN CELLULAR PHONE, NON-CLONED, POSSESSION",STOLEN PROPERTY
ROBBERY OF A RESIDENCE WITH BODILY FORCE,ROBBERY
"HAZARDOUS SUBSTANCES, DEPOSITING",OTHER OFFENSES
"DOG, FIGHTING;  OWNING, FIGHTING, OR ATTENDING FIGHT",NON-CRIMINAL
ATTEMPTED SUICIDE BY INGESTION,SUICIDE
ROBBERY OF A RESIDENCE WITH A GUN,ROBBERY
SALE OF BARBITUATES,DRUG/NARCOTIC
DISCHARGE FIREARM WITHIN CITY LIMITS,WEAPON LAWS
STOLEN TRAILER,VEHICLE THEFT
TRANSPORTATION OF HALLUCINOGENIC,DRUG/NARCOTIC
SHOOTING INTO INHABITED DWELLING OR OCCUPIED VEHICLE,ASSAULT
"ROBBERY OF A COMMERCIAL ESTABLISHMENT, STRONGARM",ROBBERY
ATTEMPTED HOMICIDE WITH A KNIFE,ASSAULT
"THROWING OBJECT AT COMMON CARRIER, PASSENGER OR FREIGHT",OTHER OFFENSES
FAILURE TO PROVIDE FOR CHILD,OTHER OFFENSES
"CHILD ABUSE, EXPLOITATION","SEX OFFENSES, FORCIBLE"
TRESPASS WITHIN 30 DAYS OF CREDIBLE THREAT,ASSAULT
GRAND THEFT FROM PERSON,LARCENY/THEFT
THEFT OF ANIMALS (GENERAL),LARCENY/THEFT
BATTERY,ASSAULT
PETTY THEFT BICYCLE,LARCENY/THEFT
"CIVIL SIDEWALKS, CITATION",NON-CRIMINAL
ARSON OF A VEHICLE,LARCENY/THEFT
SELLING/DISCHARGING OF FIRECRACKERS,OTHER OFFENSES
DAMAGE TO MAIL BOX,VANDALISM
PUTTING SLUGS IN COIN OPERATED MACHINES,FRAUD
"COUNTERFEITING, COINS OR NOTES",FORGERY/COUNTERFEITING
FOUND PERSON,NON-CRIMINAL
COURTESY REPORT,NON-CRIMINAL
STOLEN TRUCK,VEHICLE THEFT
MISCELLANEOUS LIQOUR LAW VIOLATION,LIQUOR LAWS
TAMPERING WITH MARKS ON FIREARM,VEHICLE THEFT
ROBBERY OF A RESIDENCE WITH A KNIFE,ROBBERY
"MALICIOUS MISCHIEF, VANDALISM OF VEHICLES",VANDALISM
"CHECKS, POSSESSION WITH INTENT TO PASS",FORGERY/COUNTERFEITING
ATTEMPTED MAYHEM WITH A DEADLY WEAPON,ASSAULT
"EMBEZZLEMENT, GRAND THEFT PUBLIC/PRIVATE OFFICIAL",EMBEZZLEMENT
PLACING WIFE IN HOUSE OF PROSTITUTION,PROSTITUTION
"BURGLARY,HOTEL UNDER CONSTRUCTION, FORCIBLE ENTRY",BURGLARY
AGGRESSIVE SOLICITING,OTHER OFFENSES
AFFIXING ADVERTISMENTS TO POLES,OTHER OFFENSES
CONCEALMENT/REMOVAL OF CHILD WITHOUT CONSENT,FAMILY OFFENSES
FORGE OR ALTER PRESCRIPTION,DRUG/NARCOTIC
"FIREARM, DISCHARGING AT OCCUPIED BLDG, VEHICLE, OR AIRCRAFT",ASSAULT
"CHILDREN, ABANDONMENT & NEGLECT OF (GENERAL)",FAMILY OFFENSES
GRAND THEFT FROM UNLOCKED AUTO,LARCENY/THEFT
LOCATED PROPERTY,NON-CRIMINAL
SODOMY (ADULT VICTIM),"SEX OFFENSES, FORCIBLE"
MAYHEM WITH A KNIFE,ASSAULT
OBSTRUCTIONS ON STREETS/SIDEWALKS,OTHER OFFENSES
ATTEMPTED ROBBERY SERVICE STATION W/BODILY FORCE,ROBBERY
INFLICT INJURY ON COHABITEE,ASSAULT
ROBBERY OF A CHAIN STORE WITH A GUN,ROBBERY
SUSPICIOUS OCCURRENCE,SUSPICIOUS OCC
"BURGLARY OF APARTMENT HOUSE, ATT FORCIBLE ENTRY",BURGLARY
"EMBEZZLEMENT, PETTY THEFT PUBLIC/PRIVATE OFFICIAL",EMBEZZLEMENT
"CIVIL SIDEWALKS, VIOLATION",NON-CRIMINAL
"LICENSE PLATE, RECOVERED",OTHER OFFENSES
PROPERTY FOR IDENTIFICATION,NON-CRIMINAL
GRAND THEFT PHONE BOOTH,LARCENY/THEFT
TRANSPORTAION OF CONTROLLED SUBSTANCE,DRUG/NARCOTIC
ATTEMPTED SUICIDE BY LACERATION,SUICIDE
